47	15220	https://www.airbnb.com/rooms/15220	20200212052319	2020-02-12	Best Location in NYC! TIMES SQUARE!	Super cool and spacious bedroom.!Super quiet to sleep and relax and yet in the middle of its all. 3 blocks from Times Square.  2 blocks from port authority bus terminal and major train lines in NYC!	"The apartment has a kitchen and two bedrooms with two full sized bed, There are huge windows, which provide great sun light! The shower and sink are inside the apartment and the toilet is conveniently located outside the apt in the hallway and is exclusively for the use of this apt.  The kitchen is equipped with a stove, silverware, microwave, coffee maker, blender, two Televisions, two Air conditioners .There is a internet with WIFI throughout. The kitchen can be used to cook breakfast only, and is available to eat lunch and dinner, but not to cook these meals in.  However, the Microwave is always available! The apartment is in New York City's Best Location, right in the heart of it all, only steps to the famous Times Square and theater district. Times Square is a major commercial intersection in Midtown Manhattan, New York City, USA, at the junction of Broadway and Seventh Avenue and stretching from West 42nd to West 47th Streets. Times Square, iconified as ""The Crossroads of the Wor"	Super cool and spacious bedroom.!Super quiet to sleep and relax and yet in the middle of its all. 3 blocks from Times Square.  2 blocks from port authority bus terminal and major train lines in NYC! The apartment has a kitchen and two bedrooms with two full sized bed, There are huge windows, which provide great sun light! The shower and sink are inside the apartment and the toilet is conveniently located outside the apt in the hallway and is exclusively for the use of this apt.  The kitchen is equipped with a stove, silverware, microwave, coffee maker, blender, two Televisions, two Air conditioners .There is a internet with WIFI throughout. The kitchen can be used to cook breakfast only, and is available to eat lunch and dinner, but not to cook these meals in.  However, the Microwave is always available! The apartment is in New York City's Best Location, right in the heart of it all, only steps to the famous Times Square and theater district. Times Square is a major commercial intersec	none		WI-FI User name: cleber Password: (Phone number hidden by Airbnb)	All major trains and buses lines within five min walking.	To everything in the apt. However kitchen is available to make breakfast and eat in. Fridge is available as well!	Available when guest needs me	Guest must be mindful of the other person staying in the apt keeping it neat all the  time and also making as little noise as possible when coming in or out the apt  after silent hour. Organic trash must be taken out every day to avoid proliferation of bugs and insects. Trash can is right down stairs in the way out of the apt what makes it easy to do. Guest are NOT allowed to bring guests to the apt,			https://a0.muscache.com/im/pictures/4e5f84c3-ec0b-4f7d-8a95-91553c2407a3.jpg?aki_policy=large		59734	https://www.airbnb.com/users/show/59734	Luiz	2009-12-03	New York, New York, United States	Easy going, down to earth, busy, and fun!  I just want you to have the best time possible while experiencing all of the great culture that New York has to offer!  If you have any questions, please do not hesitate to ask and I will put you on the right path!	within an hour	100%	94%	f	https://a0.muscache.com/im/pictures/user/ebc96143-4db2-4864-8bc1-6642cc0042de.jpg?aki_policy=profile_small	https://a0.muscache.com/im/pictures/user/ebc96143-4db2-4864-8bc1-6642cc0042de.jpg?aki_policy=profile_x_medium	Hell's Kitchen	2	2	['email', 'phone', 'facebook', 'reviews', 'kba']	t	t	New York, NY, United States	Hell's Kitchen	Hell's Kitchen	Manhattan	New York	NY	10018	New York	New York, NY	US	United States	40.755309999999994	-73.99293	t	Apartment	Private room	1	0.5	1.0	1	Real Bed	"{TV,Internet,Wifi,""Air conditioning"",Kitchen,""Buzzer/wireless intercom"",Heating,""Smoke detector"",""Carbon monoxide detector"",""Fire extinguisher"",Essentials,Shampoo,""Lock on bedroom door"",Hangers,""Hair dryer"",Iron,""translation missing: en.hosting_amenity_49"",""translation missing: en.hosting_amenity_50"",""Hot water"",""Bed linens"",""Extra pillows and blankets"",Microwave,""Coffee maker"",Refrigerator,""Dishes and silverware"",""Cooking basics"",""Host greets you""}"		$69.00					1	$0.00	2	29	2	2	29	29	2.0	29.0	today	t	6	15	25	274	2020-02-12	322	48	2010-01-02	2020-01-24	93.0	9.0	9.0	10.0	10.0	10.0	9.0	f			f	f	strict_14_with_grace_period	t	f	2	0	2	0	2.62
48	15341	https://www.airbnb.com/rooms/15341	20200212052319	2020-02-13	**Bright Nolita Apt w Doorman/Elevators/Gym**	Greetings! This is a bright, spartan 1-bedroom in a Luxury Nolita high-rise condo building with 24 hour lobby attendants and elevators. Amazing location with nearby subways, Whole Foods, SoHo, Lower East Side, Little Italy, Chinatown, NYU.	Hello ~ : ) I'm taking short term stays in my Nolita apartment for a minimum of 30 day stays. This is a simple, spartan 1-bedroom in an awesome, safe neighborhood.  For the stay, I am looking for guests who are Mature, Low Key, Financially Secure, Non-Smoking in the room, Relatively LOW maintenance & clean, and NON-Partying (meaning I dont mind if you like to have fun, just no throwing parties in THIS apartment, please).	Greetings! This is a bright, spartan 1-bedroom in a Luxury Nolita high-rise condo building with 24 hour lobby attendants and elevators. Amazing location with nearby subways, Whole Foods, SoHo, Lower East Side, Little Italy, Chinatown, NYU. Hello ~ : ) I'm taking short term stays in my Nolita apartment for a minimum of 30 day stays. This is a simple, spartan 1-bedroom in an awesome, safe neighborhood.  For the stay, I am looking for guests who are Mature, Low Key, Financially Secure, Non-Smoking in the room, Relatively LOW maintenance & clean, and NON-Partying (meaning I dont mind if you like to have fun, just no throwing parties in THIS apartment, please). Apartment Amenities include:  * WiFi 25/25MBps (Download/Upload) * FiOS TV (Online streaming movies, TV series, Widgets, Showtime, 260+ channels and music) * Large wall closet in bedroom * Heating/Cooling unit inside both rooms * Cable TV connection in both rooms * Large Windows * Furnished * Desk * Queen sized bed * Floor lamp  * 2 	none	This 1-bedroom apartment is conveniently located in the heart of safe, fashionable Nolita, steps away from nearby subways, Whole Foods, SoHo, Lower East Side, Little Italy, Chinatown, NYU. With lots of young professionals moving in, the neighborhood has many attractions like tons of cafes, bars, boutiques, a 42,000sq ft community center, The New Museum of Art, etc.	If there are less than 3 weeks left in your stay, please agree to have the apt available for showing by brokers or next prospects.  Thank you ~	You are a nice, pleasant and short walk away from SoHo, Chinatown, NoHo, Tribeca, Little Italy and the historic Lower East Side.  This area is perfect for someone who likes boutique shopping, eating at popular restaurants, cafes, wants to be near NYU, etc.  City transportation via the 6, F, B, D, J, Z, N, R, M subway lines and the M103 bus are all right there.	Apartment Amenities include:  * WiFi 25/25MBps (Download/Upload) * FiOS TV (Online streaming movies, TV series, Widgets, Showtime, 260+ channels and music) * Large wall closet in bedroom * Heating/Cooling unit inside both rooms * Cable TV connection in both rooms * Large Windows * Furnished * Desk * Queen sized bed * Floor lamp  * 2 Other closets * Microwave, dish washer, fridge, gas stove, dishes * 1 red microfiber sofa bed * Full Kitchen Building Amenities:  - 24 hour doorman and dramatic lobby - Elevators  - Porter service - Laundry service (basement)  - Sun deck  - Gym	Some to little interaction with guests.	Thanks for considering my place. Please:   No smoking in the apt. No loud partying in the apt. This is a high-rise condo building so you will have neighbors. No guests without permission. Overnight guests may incur a charge. -The HVACs are NOT To be stood upon. -HVACs are not to be left on unattended. -Do not yank the cords of the blinds as they will break. Thank you for your cooperation ~ :)			https://a0.muscache.com/im/pictures/01fb0be3-3cf8-4537-a251-5e6a414b2c05.jpg?aki_policy=large		60049	https://www.airbnb.com/users/show/60049	Ted	2009-12-04	New York, New York, United States	"Hello and thank you for checking out my sublet/rental!

I work with my family in the international art business.  My father is an artist and so that means I end up travelling fairly often.

When I lived there, I lived fairly spartan but all the essentials are present.  I hope you find it as comfortable as I did!! :)"	within an hour	100%	100%	f	https://a0.muscache.com/im/pictures/user/c950b8e1-d410-4b5c-b5f4-0f5ab2eb3b3a.jpg?aki_policy=profile_small	https://a0.muscache.com/im/pictures/user/c950b8e1-d410-4b5c-b5f4-0f5ab2eb3b3a.jpg?aki_policy=profile_x_medium	Soho	3	3	['email', 'phone', 'reviews', 'offline_government_id', 'kba', 'selfie', 'government_id']	t	t	New York, NY, United States	Manhattan	SoHo	Manhattan	New York	NY	10002	New York	New York, NY	US	United States	40.7221	-73.99775	t	Condominium	Entire home/apt	2	1.0	1.0	2	Real Bed	"{TV,""Cable TV"",Internet,Wifi,""Air conditioning"",Kitchen,""Paid parking off premises"",Doorman,Gym,Elevator,""Free street parking"",""Buzzer/wireless intercom"",Heating,Washer,Dryer,""Smoke detector"",""Carbon monoxide detector"",Essentials,Shampoo,Hangers,""Hair dryer"",Iron,""Laptop friendly workspace"",""translation missing: en.hosting_amenity_49"",""translation missing: en.hosting_amenity_50"",""Self check-in"",""Building staff"",Bathtub,""Hot water"",""Bed linens"",""Ethernet connection"",Microwave,Refrigerator,Dishwasher,""Dishes and silverware"",""Cooking basics"",Oven,Stove,""Patio or balcony"",""Luggage dropoff allowed"",""Long term stays allowed"",""Shower gel"",""Trash can""}"		$180.00		$4,550.00	$500.00	$160.00	2	$0.00	6	366	6	6	1125	1125	6.0	1125.0	today	t	8	9	9	9	2020-02-13	25	7	2013-10-01	2019-10-07	91.0	9.0	9.0	10.0	10.0	9.0	9.0	f			f	f	moderate	t	t	1	1	0	0	0.32
49	15385	https://www.airbnb.com/rooms/15385	20200212052319	2020-02-13	Very, very cozy place	A home away from home.Its a very cute and charming. full size bed (sheets and towels included). VERY CLEAN  You are welcome to use the kitchen. Amazing stores, restaurants and cafes. Close to the river and to the Williamsburg bridge No smoking and no pets.	Best location in Williamsburg - Brooklyn, first stop on the L, J,Z.M 10 to 15 min walk. Close to Bedford av. The apartment is overall a welcoming space. Small and charming. You will get a private room, my room is at the oposite end. Very comfortable kitchen and I will like  to keep it spotless at all time. Be ready to go up 4 floors. A good way to keep your legs in shape ;)	A home away from home.Its a very cute and charming. full size bed (sheets and towels included). VERY CLEAN  You are welcome to use the kitchen. Amazing stores, restaurants and cafes. Close to the river and to the Williamsburg bridge No smoking and no pets. Best location in Williamsburg - Brooklyn, first stop on the L, J,Z.M 10 to 15 min walk. Close to Bedford av. The apartment is overall a welcoming space. Small and charming. You will get a private room, my room is at the oposite end. Very comfortable kitchen and I will like  to keep it spotless at all time. Be ready to go up 4 floors. A good way to keep your legs in shape ;) For the most part ill be at the apartment while is rented. Williamsburg is one of the best places to be n Brooklyn. super cool vibe, amazing shops and restaurant just 10 to 15 min on the train to Manhattan.  Some days you don't even have to leave the neighborhood, It is a great place to hangout. L, J M and Z	none	Williamsburg is one of the best places to be n Brooklyn. super cool vibe, amazing shops and restaurant just 10 to 15 min on the train to Manhattan.  Some days you don't even have to leave the neighborhood, It is a great place to hangout.		L, J M and Z		For the most part ill be at the apartment while is rented.	No shoes @ home and the common areas always super clean. No smoking and no pets.			https://a0.muscache.com/im/pictures/50776527-2518-41be-8226-f667b9097739.jpg?aki_policy=large		60252	https://www.airbnb.com/users/show/60252	Cristina	2009-12-05	New York, New York, United States	I am from Colombia. Love to travel and the ocean.	within a few hours	100%	95%	t	https://a0.muscache.com/im/users/60252/profile_pic/1260033271/original.jpg?aki_policy=profile_small	https://a0.muscache.com/im/users/60252/profile_pic/1260033271/original.jpg?aki_policy=profile_x_medium	Williamsburg	1	1	['email', 'phone', 'reviews', 'kba']	t	t	Brooklyn, NY, United States	Williamsburg	Williamsburg	Brooklyn	Brooklyn	NY	11249	New York	Brooklyn, NY	US	United States	40.71185	-73.96204	t	Apartment	Private room	1	1.0	1.0	1	Real Bed	"{Wifi,""Air conditioning"",Kitchen,Heating,""Smoke detector"",""Carbon monoxide detector"",""First aid kit"",""Safety card"",Essentials,""Lock on bedroom door"",""translation missing: en.hosting_amenity_49"",""translation missing: en.hosting_amenity_50"",""Self check-in"",Lockbox,""Hot water"",Refrigerator,""Dishes and silverware"",""Cooking basics"",Oven,Stove}"		$90.00		$1,200.00	$0.00	$100.00	1	$10.00	2	60	2	2	60	60	2.0	60.0	4 days ago	t	0	1	1	134	2020-02-13	49	12	2010-05-16	2020-02-07	97.0	10.0	10.0	10.0	10.0	10.0	9.0	f			f	f	strict_14_with_grace_period	f	f	1	0	1	0	0.41
50	15396	https://www.airbnb.com/rooms/15396	20200212052319	2020-02-12	Sunny & Spacious Chelsea Apartment	Modern, spacious, bright and well designed apartment in Chelsea/Midtown Manhattan close to everything & a great spot to explore the city!  Family-friendly space with great food shopping nearby.  Also very well suited for business travelers. Minimum rental period: +30 nights		Modern, spacious, bright and well designed apartment in Chelsea/Midtown Manhattan close to everything & a great spot to explore the city!  Family-friendly space with great food shopping nearby.  Also very well suited for business travelers. Minimum rental period: +30 nights Available via phone, text, email to help with any questions you may have and happy to recommend restaurants etc. Explore Chelsea's thriving new gallery district, Midtown Manhattan shopping, museums, restaurants and nightlife. Excellent location for a NYC visit. Two Subway stops (A/C/E and 1/2/3 train lines) are within 1 block of the apartment. A variety of parking garages are nearby. Can not accept reservations more than 6 weeks in advance.	none	Explore Chelsea's thriving new gallery district, Midtown Manhattan shopping, museums, restaurants and nightlife. Excellent location for a NYC visit.	Can not accept reservations more than 6 weeks in advance.	Two Subway stops (A/C/E and 1/2/3 train lines) are within 1 block of the apartment. A variety of parking garages are nearby.		Available via phone, text, email to help with any questions you may have and happy to recommend restaurants etc.	Pets considered.  This is a non-smoking building and apartment.			https://a0.muscache.com/im/pictures/575128a1-08e7-4ae8-8509-9610c688f56e.jpg?aki_policy=large		60278	https://www.airbnb.com/users/show/60278	Petra	2009-12-05	New York, New York, United States		within a day	100%	44%	f	https://a0.muscache.com/im/pictures/user/0bd73531-f5a3-44b6-af8c-de11b3274d55.jpg?aki_policy=profile_small	https://a0.muscache.com/im/pictures/user/0bd73531-f5a3-44b6-af8c-de11b3274d55.jpg?aki_policy=profile_x_medium	Chelsea	2	2	['email', 'phone', 'reviews', 'kba']	t	t	New York, NY, United States	Chelsea	Chelsea	Manhattan	New York	NY	10001	New York	New York, NY	US	United States	40.74623	-73.9953	t	Apartment	Entire home/apt	4	2.0	2.0	2	Real Bed	"{TV,""Cable TV"",Internet,Wifi,""Air conditioning"",""Wheelchair accessible"",Kitchen,""Paid parking off premises"",""Pets allowed"",Elevator,""Buzzer/wireless intercom"",Heating,""Family/kid friendly"",""Suitable for events"",Washer,Dryer,""Smoke detector"",""Carbon monoxide detector"",""First aid kit"",""Safety card"",""Fire extinguisher"",Essentials,Shampoo,""24-hour check-in"",Hangers,""Hair dryer"",Iron,""Laptop friendly workspace"",Bathtub,""High chair"",""Children’s books and toys"",Crib,""Pack ’n Play/travel crib"",""Children’s dinnerware"",""Hot water"",Microwave,""Coffee maker"",Refrigerator,Dishwasher,""Dishes and silverware"",""Cooking basics"",Oven,Stove,""Host greets you""}"		$375.00	$2,750.00	$7,500.00	$1,000.00	$120.00	2	$50.00	180	365	180	180	365	365	180.0	365.0	11 months ago	t	30	60	90	180	2020-02-12	5	0	2016-03-23	2018-11-03	100.0	10.0	10.0	10.0	10.0	10.0	10.0	f			f	f	strict_14_with_grace_period	f	f	1	1	0	0	0.11
51	15711	https://www.airbnb.com/rooms/15711	20200212052319	2020-02-12	2 bedroom - Upper East Side-great for kids	This apartment is  perfect for families. A Queen bed in the master bedroom and a nursery with a crib (or toddler bed) and a full sized bunk bed. (Two- need to update the picture). The living room has a new couch that can be two Twin Beds or one slide into a Queen (no pullout frame!).  There is air conditioning in each room, TV in the living room and the master bedroom, and a full kitchen. Updated pictures are coming.	Enjoy an excellent and much more reasonably priced and comfortable alternative to a New York City hotel. Our newly renovated 2 bedroom is located on the charming, tree lined, park block of 77th Street between York Avenue and John Jay Park -  right in the middle of the very safe, Upper East Side. The apartment is a 5th floor walk-up in a beautiful Historic Old World style building with a central courtyard. This apartment can sleep 6 people and a baby.  The apartment has high ceilings, 4 floor to ceiling windows  (lots of light) and hard wood flooring throughout. The master bedroom has a queen  sized bed, dresser,TV, closet and two windows.   The second bedroom is small and set up for our two kids, but has a floor to ceiling window, crib, closet and  a full sized bunk bed. The living room has a large flat screen TV, a  comfortable sectional sofa that can convert to two twin beds or a Queen sized bed.   It has an eat-in kitchen, which is large for NYC and opens into the living room.  Many	This apartment is  perfect for families. A Queen bed in the master bedroom and a nursery with a crib (or toddler bed) and a full sized bunk bed. (Two- need to update the picture). The living room has a new couch that can be two Twin Beds or one slide into a Queen (no pullout frame!).  There is air conditioning in each room, TV in the living room and the master bedroom, and a full kitchen. Updated pictures are coming. Enjoy an excellent and much more reasonably priced and comfortable alternative to a New York City hotel. Our newly renovated 2 bedroom is located on the charming, tree lined, park block of 77th Street between York Avenue and John Jay Park -  right in the middle of the very safe, Upper East Side. The apartment is a 5th floor walk-up in a beautiful Historic Old World style building with a central courtyard. This apartment can sleep 6 people and a baby.  The apartment has high ceilings, 4 floor to ceiling windows  (lots of light) and hard wood flooring throughout. The master 	none	Wonderful and safe upper east side. There is a pubic park and a pool next door (pool open July-aug). The area is packed with restaurants and bars and offers a nice oasis away from the rest of busy Manhattan. If you want to explore the remaining part of Manhattan, you have access to 79th street and 59th street cross town buses just a block away and the: Q subway about an 8 minute walk on 72nd and 2nd ave.  6 subway about a 10 minute walk away on 77th st. and Lexington Ave. Nearby: - 15 minutes on subway to Times Square  - 13 minute walk/3 minute cab ride to Central Park, Met. & Whitney.  - 10 minute or 12 dollar cab to the Village  - 10 minute walk to the 4/5/6 line (takes you to midtown in 6 minutes)  - 5 minute walk to Gracie Mansion and Charles Shutz Park  - 2 minute walk to thousands of restaurants  - 1 minute walk to East River walkway  - 30 seconds from John Jay Park – kids area, swings, Olympic size pool (summer), bball	This is for a minimum one month rental		Whole space	Up to you. We generally step back and let the guests enjoy their vacation unless something is needed. You will have our phone numbers to reach us.				https://a0.muscache.com/im/pictures/c444be23-6b18-4094-b2c7-cee811c08c9c.jpg?aki_policy=large		61491	https://www.airbnb.com/users/show/61491	D	2009-12-09	New York, New York, United States	Nyc	within an hour	100%	96%	f	https://a0.muscache.com/im/pictures/user/3bd9d7eb-c9c3-453e-ba3d-712c60c6b3b0.jpg?aki_policy=profile_small	https://a0.muscache.com/im/pictures/user/3bd9d7eb-c9c3-453e-ba3d-712c60c6b3b0.jpg?aki_policy=profile_x_medium	Upper East Side	2	2	['email', 'phone', 'facebook', 'reviews', 'jumio', 'offline_government_id', 'government_id', 'work_email']	t	t	New York, NY, United States	Upper East Side	Upper East Side	Manhattan	New York	NY	10162	New York	New York, NY	US	United States	40.77065	-73.95269	t	Apartment	Entire home/apt	6	1.0	2.0	4	Real Bed	"{TV,""Cable TV"",Internet,Wifi,""Air conditioning"",Pool,Kitchen,""Free street parking"",""Buzzer/wireless intercom"",Heating,""Family/kid friendly"",Washer,Dryer,""Smoke detector"",""Carbon monoxide detector"",Essentials,Shampoo,""24-hour check-in"",Hangers,""Hair dryer"",Iron,""Laptop friendly workspace"",""Self check-in"",Lockbox,""Outlet covers"",""Baby bath"",""Changing table"",""High chair"",""Stair gates"",""Children’s books and toys"",""Table corner guards"",""Babysitter recommendations"",Crib,""Room-darkening shades"",""Children’s dinnerware"",""Hot water"",""Bed linens"",""Extra pillows and blankets"",Microwave,""Coffee maker"",Refrigerator,Dishwasher,""Dishes and silverware"",""Cooking basics"",Oven,Stove,""Long term stays allowed""}"		$200.00	$2,000.00	$6,000.00	$500.00	$200.00	6	$20.00	2	1125	2	2	1125	1125	2.0	1125.0	2 weeks ago	t	8	20	27	211	2020-02-12	80	15	2010-01-06	2020-01-26	93.0	9.0	9.0	9.0	9.0	10.0	9.0	f			t	f	strict_14_with_grace_period	f	f	2	2	0	0	0.65
52	15729	https://www.airbnb.com/rooms/15729	20200212052319	2020-02-13	Village Green		Beautiful bedroom in a duplex house with large outdoor garden.  Located in Red Hook Brooklyn just a short walk to the water, great views of lower Manhattan and the statue of liberty.   NOTE: THIS LISTING IS FOR (1) PRIVATE ROOM YOU CAN RENT THE ENTIRE DUPLEX AS WELL in another listing.	Beautiful bedroom in a duplex house with large outdoor garden.  Located in Red Hook Brooklyn just a short walk to the water, great views of lower Manhattan and the statue of liberty.   NOTE: THIS LISTING IS FOR (1) PRIVATE ROOM YOU CAN RENT THE ENTIRE DUPLEX AS WELL in another listing.	none									https://a0.muscache.com/im/pictures/d41d92e9-1887-4b7b-96ec-f84117e567c4.jpg?aki_policy=large		61531	https://www.airbnb.com/users/show/61531	David	2009-12-09	New York, New York, United States	From NYC air host and traveler, love to Cook sell Danish modern furniture. 	within an hour	100%	33%	f	https://a0.muscache.com/im/users/61531/profile_pic/1260832675/original.jpg?aki_policy=profile_small	https://a0.muscache.com/im/users/61531/profile_pic/1260832675/original.jpg?aki_policy=profile_x_medium	Red Hook	3	3	['email', 'phone', 'reviews', 'kba']	t	t	Brooklyn, NY, United States	Brooklyn	Red Hook	Brooklyn	Brooklyn	NY	11231	New York	Brooklyn, NY	US	United States	40.67695	-74.01120999999999	t	House	Private room	4	1.0	1.0	1	Real Bed	"{Wifi,""Air conditioning"",Kitchen,""Pets allowed"",""Pets live on this property"",Dog(s),""Buzzer/wireless intercom"",Heating,""Family/kid friendly"",""Suitable for events"",Washer,Dryer}"		$89.00	$595.00	$2,150.00	$300.00	$60.00	1	$45.00	12	730	12	12	730	730	12.0	730.0	7 months ago	t	0	0	0	0	2020-02-13	25	0	2010-05-31	2017-05-21	79.0	7.0	7.0	9.0	9.0	8.0	7.0	f			f	f	strict_14_with_grace_period	f	f	2	1	1	0	0.21
