22	9657	https://www.airbnb.com/rooms/9657	20200212052319	2020-02-12	Modern 1 BR / NYC / EAST VILLAGE	Awesome, spacious & clean 1 bedroom with a cozy, designer vibe. Located in the east village, it is perfectly convenient for great restaurants and bars of all varieties. Super convenient access to subway lines; only 4 blocks from L train or quick walk to Union Square with access to N, R, Q and 4,5,6, short walk to F, V at 2nd Avenue or 6 at Astor place.	The east village offers a mixture of old school cool NY flavor and new school sophistication. Fun and unique boutiques and cafes line the streets. For some urban nature, Thompkins Square Park is just 1 block east. Although the neighborhood is lively and fun, the apartment is nice and quiet at night. As a designer in the interior/home field, I bring a unique element of style to my home. If you are interested in a classic, cool downtown experience in comfortable spot, this is for you!!!	Awesome, spacious & clean 1 bedroom with a cozy, designer vibe. Located in the east village, it is perfectly convenient for great restaurants and bars of all varieties. Super convenient access to subway lines; only 4 blocks from L train or quick walk to Union Square with access to N, R, Q and 4,5,6, short walk to F, V at 2nd Avenue or 6 at Astor place. The east village offers a mixture of old school cool NY flavor and new school sophistication. Fun and unique boutiques and cafes line the streets. For some urban nature, Thompkins Square Park is just 1 block east. Although the neighborhood is lively and fun, the apartment is nice and quiet at night. As a designer in the interior/home field, I bring a unique element of style to my home. If you are interested in a classic, cool downtown experience in comfortable spot, this is for you!!! Maps, Local recommendations, Menus The east village offers a mixture of old school cool NY flavor and new school sophistication. Fun and unique boutiques a	none	The east village offers a mixture of old school cool NY flavor and new school sophistication. Fun and unique boutiques and cafes line the streets. For some urban nature, Thompkins Square Park is just 1 block east. Although the neighborhood is lively and fun, the apartment is nice and quiet at night. As a designer in the interior/home field, I bring a unique element of style to my home. If you are interested in a classic, cool downtown experience in comfortable spot, this is for you!!!		Super convenient access to subway lines & buses; only 4 blocks from L train or quick walk to Union Square with access to N, R, Q and 4,5,6, short walk to F, V at 2nd Avenue or 6 at Astor place.	Maps, Local recommendations, Menus		Coasters on all wood furniture. Respect the neighbors, apartment and building. Do not leave garbage behind. No house parties.			https://a0.muscache.com/im/pictures/6476785/5768bbc7_original.jpg?aki_policy=large		21904	https://www.airbnb.com/users/show/21904	Dana	2009-06-16	New York, New York, United States	I am an industrial designer and native new yorker. I love living in the chaos of the city but also having a quiet, serene home to escape to. My work and curiosity sends me traveling all over the world that's why I can offer my apartment for others to experience and enjoy.	within a few hours	100%	87%	t	https://a0.muscache.com/im/users/21904/profile_pic/1339612803/original.jpg?aki_policy=profile_small	https://a0.muscache.com/im/users/21904/profile_pic/1339612803/original.jpg?aki_policy=profile_x_medium	East Village	1	1	['email', 'phone', 'reviews', 'kba']	t	t	New York, NY, United States	East Village	East Village	Manhattan	New York	NY	10003	New York	New York, NY	US	United States	40.7292	-73.98541999999999	t	Apartment	Entire home/apt	3	1.0	1.0	1	Real Bed	"{TV,""Cable TV"",Internet,Wifi,""Air conditioning"",Kitchen,""Buzzer/wireless intercom"",Heating,""Family/kid friendly"",""Smoke detector"",""First aid kit"",""Fire extinguisher"",Essentials,Shampoo,Hangers,""Hair dryer"",Iron,""Laptop friendly workspace"",""Hot water"",""Bed linens"",""Extra pillows and blankets"",Microwave,""Coffee maker"",Refrigerator,""Dishes and silverware"",""Cooking basics"",Oven,Stove,""Luggage dropoff allowed"",""Shower gel"",""Baking sheet"",""Trash can""}"		$175.00				$100.00	1	$25.00	3	75	3	3	75	75	3.0	75.0	2 days ago	t	30	57	83	195	2020-02-12	33	6	2009-09-08	2019-11-11	94.0	10.0	9.0	10.0	10.0	10.0	9.0	f			f	f	strict_14_with_grace_period	f	f	1	1	0	0	0.26
23	9668	https://www.airbnb.com/rooms/9668	20200212052319	2020-02-12	front room/double bed	for couples or friends who are ok with sharing a bed. it's in the front of the apartment & while everyone must walk past it when they enter, it offers a bit more privacy than the other room(s) as it is more isolated. more noise from the nearby stairs	"_________________________________________________ F.A.Q. F.A.Q. F.A.Q. F.A.Q. F.A.Q. F.A.Q. F.A.Q. F.A.Q.  FREQUENTLY ASKED QUESTIONS -------------------------------------------------------------------------------------- Hi, are xx-xx dates available? check the calendar, if there's availability, feel free to make a booking, i've had many times other guests book the dates someone is looking for because they are writing to ask me if the days they want are available.  --------------- Where are you located?? check the tab on this listing that says ""location"", that will show you where i live, and where you will be located in relation to wherever you would like to visit. --------------- How far away are you from X? times square- 15 minutes central park 10-20min(depends where, it's big) midtown west 15 minutes midtown east 20-25 minutes union square 25 minutes   east village 30 minutes downtown 30-35 minutes again, look at the ""location"" tab/link on this listing. do you know the address? i ha"	"for couples or friends who are ok with sharing a bed. it's in the front of the apartment & while everyone must walk past it when they enter, it offers a bit more privacy than the other room(s) as it is more isolated. more noise from the nearby stairs _________________________________________________ F.A.Q. F.A.Q. F.A.Q. F.A.Q. F.A.Q. F.A.Q. F.A.Q. F.A.Q.  FREQUENTLY ASKED QUESTIONS -------------------------------------------------------------------------------------- Hi, are xx-xx dates available? check the calendar, if there's availability, feel free to make a booking, i've had many times other guests book the dates someone is looking for because they are writing to ask me if the days they want are available.  --------------- Where are you located?? check the tab on this listing that says ""location"", that will show you where i live, and where you will be located in relation to wherever you would like to visit. --------------- How far away are you from X? times square- 15 minutes centr"	none	Just about everything you will ever need is within a few blocks of the apartment (typical Manhattan); pharmacy, hardware store, deli, laundry, etc. There are quite a few grocery stores/ supermarkets nearby, including Fairway, which carries gourmet and organic foods. Fresh direct also delivers to the area.  There's a good variety of restaurants nearby. You can get anything from a juicy, hand-formed burger, to curry dishes, to $1 homemade tamales on the street, to churrasco, to burritos, to sushi 'til 2am; I think you get the point.  The area is safe, parking spaces are available, and your car will be secure. People are very nice, and friendly. It is very neighborhood-y; hell, the crossing guard knows my name. It is more of a family neighborhood, but there are also many young people in the area because of the great number of schools nearby.  The apartment is conveniently located right down the street from City College and just 2 stops from Columbia, Barnard, Teachers College, Manhattan S	this is a very old building and my place is very modest, but I like to keep it nice and clean.  The apartment is pretty quiet most of the time.	buses and subway 24 hrs within 60-150m	bedroom, bathroom, kitchen, fridge, eating area (can't really call it a dining room), living room.	it depends, i read people to see if they want to be left alone or not.	Please take off your shoes when you enter and clean up after yourself.  Please do not leave hair clogging the tub drain, crumbs of food laying around, even though you put away your food, etc. because you will be sharing my flat with me and possibly other guests too, so please be courteous.  Also, please turn off lights when you leave a room, or the flat/apt.			https://a0.muscache.com/im/pictures/5821fadb-4590-40c3-946f-70573237ad56.jpg?aki_policy=large		32294	https://www.airbnb.com/users/show/32294	Ssameer Or Trip	2009-08-18	New York, New York, United States	private chef, creative person, open minded, health conscious environmentalist, foodie, food activist, freelance nutritional/weight loss/counselor/meal planner, food & music snob. gay friendly.  basshead			100%	f	https://a0.muscache.com/im/pictures/user/ffd448ea-a36c-4827-9319-ba758456cce3.jpg?aki_policy=profile_small	https://a0.muscache.com/im/pictures/user/ffd448ea-a36c-4827-9319-ba758456cce3.jpg?aki_policy=profile_x_medium	Hamilton Heights	3	3	['email', 'phone', 'reviews', 'jumio', 'government_id']	t	t	New York, NY, United States	Manhattan	Harlem	Manhattan	New York	NY	10031	New York	New York, NY	US	United States	40.82245	-73.95104	t	Apartment	Private room	2	1.0	1.0	1	Futon	"{Internet,Wifi,Pool,Kitchen,""Paid parking off premises"",""Free street parking"",""Buzzer/wireless intercom"",Heating,""Smoke detector"",""Carbon monoxide detector"",Essentials,""Lock on bedroom door"",Hangers,""Hair dryer"",Iron,""translation missing: en.hosting_amenity_49"",""translation missing: en.hosting_amenity_50"",""Hot water"",""Bed linens"",""Extra pillows and blankets"",Microwave,Refrigerator,""Dishes and silverware"",""Cooking basics"",Oven,Stove,""Single level home"",""Luggage dropoff allowed"",""Long term stays allowed"",Other}"		$50.00			$0.00	$15.00	1	$10.00	3	365	3	3	365	365	3.0	365.0	5 months ago	t	30	60	90	365	2020-02-12	258	27	2009-10-04	2019-12-10	87.0	9.0	8.0	9.0	10.0	10.0	9.0	f			t	f	moderate	f	f	2	0	2	0	2.05
24	9704	https://www.airbnb.com/rooms/9704	20200212052319	2020-02-12	Spacious 1 bedroom in luxe building	The room is spacious, the neighborhood is safe, and you are 10 blocks north of Central Park. The Subway is a 4 minute walk with Express and Local trains.  Plenty of restaurants, bars and cafes nearby. The room has a desk and chair. Sorry, the picture has not been updated.	Comfortable and conveniently located 2 bedroom, 1.5 bathroom in the best area in Harlem (8th Avenue, between 120th and 121st streets). The second bedroom has a closet, dresser, and full size bed.  It is fully equipped with fresh linen, towels, etc. Please note, I only rent the room to two guests when I am out of town. Large modern living room/dining room has a sofa bed, tv but no cable, wifi (throughout apt), antique dining room table and chairs… Full kitchen with everything you could possible need and washer / dryer Nearby Restaurants/bars: Vinteria - (8th Ave & 119th) Delicious café / restaurant “Les Ambassades” (8th Ave & 119th) Cedric - French (119th and St. Nicolas) Billy's Black - (119th and St. Nicolas) Harlem Food Bar - (114th & 8th) Bier Garden - (113th & 8th) Frederick Bistro (8th & 114th) Lido - Italian (8th &117th) Harlem Tavern (8th &116th) Five and Diamond (8th & 113th) Zoma - Ethiopian (8th & 113th) Melba's - Soul Food (8th & 114th) Max Soha - Italian (Amsterdam & 123rd)	The room is spacious, the neighborhood is safe, and you are 10 blocks north of Central Park. The Subway is a 4 minute walk with Express and Local trains.  Plenty of restaurants, bars and cafes nearby. The room has a desk and chair. Sorry, the picture has not been updated. Comfortable and conveniently located 2 bedroom, 1.5 bathroom in the best area in Harlem (8th Avenue, between 120th and 121st streets). The second bedroom has a closet, dresser, and full size bed.  It is fully equipped with fresh linen, towels, etc. Please note, I only rent the room to two guests when I am out of town. Large modern living room/dining room has a sofa bed, tv but no cable, wifi (throughout apt), antique dining room table and chairs… Full kitchen with everything you could possible need and washer / dryer Nearby Restaurants/bars: Vinteria - (8th Ave & 119th) Delicious café / restaurant “Les Ambassades” (8th Ave & 119th) Cedric - French (119th and St. Nicolas) Billy's Black - (119th and St. Nicolas) Harlem 	none						No smoking No pets Renter would have the 2nd bedroom with full size bed, linen and towels.			https://a0.muscache.com/im/pictures/38418/569b54fd_original.jpg?aki_policy=large		32045	https://www.airbnb.com/users/show/32045	Teri	2009-08-16	US	"I'm a citizen of the world.  I love to travel and meet people from other cultures. 

I used to live in Paris and I've spent time in Spain and Italy. I also love salsa and jazz music. 
"	within a day	67%	43%	f	https://a0.muscache.com/im/users/32045/profile_pic/1259116128/original.jpg?aki_policy=profile_small	https://a0.muscache.com/im/users/32045/profile_pic/1259116128/original.jpg?aki_policy=profile_x_medium	Harlem	1	1	['email', 'phone', 'reviews', 'jumio', 'offline_government_id', 'selfie', 'government_id', 'identity_manual']	t	t	New York, NY, United States	Harlem	Harlem	Manhattan	New York	NY	10027	New York	New York, NY	US	United States	40.81305	-73.95466	f	Apartment	Private room	2	1.0	1.0	1	Real Bed	"{TV,""Cable TV"",Internet,Wifi,""Air conditioning"",Kitchen,Elevator,""Buzzer/wireless intercom"",Heating,""Smoke detector"",""Carbon monoxide detector"",""Fire extinguisher""}"	900.0	$52.00		$1,700.00	$150.00	$50.00	1	$15.00	2	730	2	2	730	730	2.0	730.0	6 weeks ago	t	15	40	46	248	2020-02-12	97	17	2014-06-10	2019-11-09	98.0	10.0	9.0	10.0	10.0	10.0	10.0	f			f	f	strict_14_with_grace_period	f	f	1	0	1	0	1.4
25	9783	https://www.airbnb.com/rooms/9783	20200212052319	2020-02-12	back room/bunk beds	this simple small room is good for  friends traveling together or couples who don't mind sleeping in separate beds while they stay here. you must walk past the living room where there may be guests or the host(ess) hanging out.	"_________________________________________________ F.A.Q. F.A.Q. F.A.Q. F.A.Q. F.A.Q. F.A.Q. F.A.Q. F.A.Q.  FREQUENTLY ASKED QUESTIONS -------------------------------------------------------------------------------------- Hi, are xx-xx dates available? check the calendar, if there's availability, feel free to make a booking, i've had many times other guests book the dates someone is looking for because they are writing to ask me if the days they want are available.  --------------- Where are you located?? check the tab on this listing that says ""location"", that will show you where i live, and where you will be located in relation to wherever you would like to visit. --------------- How far away are you from X? times square- 15 minutes central park 10-20min(depends where, it's big) midtown west 15 minutes midtown east 20-25 minutes union square 25 minutes   east village 30 minutes downtown 30-35 minutes again, look at the ""location"" tab/link on this listing. do you know the address? i ha"	"this simple small room is good for  friends traveling together or couples who don't mind sleeping in separate beds while they stay here. you must walk past the living room where there may be guests or the host(ess) hanging out. _________________________________________________ F.A.Q. F.A.Q. F.A.Q. F.A.Q. F.A.Q. F.A.Q. F.A.Q. F.A.Q.  FREQUENTLY ASKED QUESTIONS -------------------------------------------------------------------------------------- Hi, are xx-xx dates available? check the calendar, if there's availability, feel free to make a booking, i've had many times other guests book the dates someone is looking for because they are writing to ask me if the days they want are available.  --------------- Where are you located?? check the tab on this listing that says ""location"", that will show you where i live, and where you will be located in relation to wherever you would like to visit. --------------- How far away are you from X? times square- 15 minutes central park 10-20min(depend"	none	the diversity, safety and convenience are what make this a great neighborhood to stay in while visiting NYC. despite being a bit uptown, still being in manhattan, there are many more conveniences than staying in almost any part of brooklyn, queens, the bronx, etc.		buses and subway 24 hrs within 65-80m	bedroom, bathroom, kitchen, fridge, eating area (can't really call it a dining room), living room.	it depends, i am fairly good at reading people to see if they want to be left alone or not. also, sometimes i need to be alone or have something to do and wont be interacting with guests, but i will always do my best to be accommodating and helpful.	House rules are pretty simple.  Please take off your shoes when you enter and clean up after yourself. i.e. do not leave hair clogging the tub drain, crumbs of food laying around, even though you put away your food, etc. because you will be sharing my flat with me and possibly other guests too, so please be courteous.  Turn off lights when you leave a room, or the flat/apt.			https://a0.muscache.com/im/pictures/53869/30fd87c0_original.jpg?aki_policy=large		32294	https://www.airbnb.com/users/show/32294	Ssameer Or Trip	2009-08-18	New York, New York, United States	private chef, creative person, open minded, health conscious environmentalist, foodie, food activist, freelance nutritional/weight loss/counselor/meal planner, food & music snob. gay friendly.  basshead			100%	f	https://a0.muscache.com/im/pictures/user/ffd448ea-a36c-4827-9319-ba758456cce3.jpg?aki_policy=profile_small	https://a0.muscache.com/im/pictures/user/ffd448ea-a36c-4827-9319-ba758456cce3.jpg?aki_policy=profile_x_medium	Hamilton Heights	3	3	['email', 'phone', 'reviews', 'jumio', 'government_id']	t	t	New York, NY, United States	Hamilton Heights	Harlem	Manhattan	New York	NY	10031	New York	New York, NY	US	United States	40.8213	-73.95318	t	Apartment	Private room	2	1.0	1.0	2	Futon	"{Internet,Wifi,""Air conditioning"",Pool,Kitchen,""Free street parking"",""Buzzer/wireless intercom"",Heating,""Smoke detector"",""Carbon monoxide detector"",Essentials,""Lock on bedroom door"",Hangers,""Hair dryer"",Iron,""Laptop friendly workspace"",""Hot water"",""Bed linens"",""Extra pillows and blankets"",Microwave,Refrigerator,""Dishes and silverware"",""Cooking basics"",Oven,Stove,""Single level home"",""Luggage dropoff allowed"",""Long term stays allowed"",""Host greets you""}"		$50.00			$0.00	$15.00	1	$10.00	3	365	3	3	365	365	3.0	365.0	5 months ago	t	30	60	90	365	2020-02-12	287	28	2010-01-14	2019-11-25	89.0	9.0	8.0	9.0	9.0	10.0	9.0	f			t	f	moderate	f	f	2	0	2	0	2.34
26	10452	https://www.airbnb.com/rooms/10452	20200212052319	2020-02-12	Large B&B Style rooms		Private Rooms for Rent (Phone number hidden by Airbnb) EVERYTHING IS INCLUDED!!! JUST BRING YOUR CLOTHES.  $70  Low monthly rental rate  Offering a lovely furnished private rooms with full kitchen and bathroom in a brand new home for male or female. Perfect for travelers, students, international guests.  Included:  All Utilities  Comfortable bed or pullout sofa (full size with fine linens, soaps and towels)  Fully equipped Kitchen and bath  All Rooms are extremely Clean and large  TV, High speed internet cable  Wireless internet  Housekeeping  Laundry room on premises  Great location: Franklin Avenue in Downtown Brooklyn.  Clean and Safe area. Two blocks from the A, C, and Shuttle train to the B, Q. Quick stops to Manhattan. Close to shopping area.	Private Rooms for Rent (Phone number hidden by Airbnb) EVERYTHING IS INCLUDED!!! JUST BRING YOUR CLOTHES.  $70  Low monthly rental rate  Offering a lovely furnished private rooms with full kitchen and bathroom in a brand new home for male or female. Perfect for travelers, students, international guests.  Included:  All Utilities  Comfortable bed or pullout sofa (full size with fine linens, soaps and towels)  Fully equipped Kitchen and bath  All Rooms are extremely Clean and large  TV, High speed internet cable  Wireless internet  Housekeeping  Laundry room on premises  Great location: Franklin Avenue in Downtown Brooklyn.  Clean and Safe area. Two blocks from the A, C, and Shuttle train to the B, Q. Quick stops to Manhattan. Close to shopping area. Two blocks from the A, C, S train with quick and easy access to Manhattan.	none			Two blocks from the A, C, S train with quick and easy access to Manhattan.			Absolutely no smoking. Please respect the home and the neighborhood.			https://a0.muscache.com/im/pictures/16336315/c4bf41e8_original.jpg?aki_policy=large		35935	https://www.airbnb.com/users/show/35935	Angela	2009-09-03	New York, New York, United States	 Loves to travel and host.	within a few hours	100%	55%	f	https://a0.muscache.com/im/users/35935/profile_pic/1327950655/original.jpg?aki_policy=profile_small	https://a0.muscache.com/im/users/35935/profile_pic/1327950655/original.jpg?aki_policy=profile_x_medium	Bedford-Stuyvesant	0	0	['email', 'phone', 'reviews', 'offline_government_id', 'selfie', 'government_id']	t	f	Brooklyn, NY, United States	Brooklyn	Bedford-Stuyvesant	Brooklyn	Brooklyn	NY	11238	New York	Brooklyn, NY	US	United States	40.6831	-73.95473	t	Apartment	Private room	3	1.0	1.0	0	Real Bed	"{TV,""Cable TV"",Internet,Wifi,""Air conditioning"",Kitchen,""Buzzer/wireless intercom"",Heating,Washer,Dryer,""Smoke detector"",""Carbon monoxide detector"",Essentials,Shampoo,Hangers,""Hair dryer"",Iron,""Laptop friendly workspace"",""Hot water"",""Bed linens"",""Extra pillows and blankets""}"		$70.00	$420.00	$1,100.00			1	$10.00	1	730	1	1	730	730	1.0	730.0	4 months ago	t	0	0	0	221	2020-02-12	75	3	2010-04-18	2019-10-12	93.0	9.0	9.0	10.0	10.0	9.0	9.0	f			f	f	strict_14_with_grace_period	f	f	2	0	2	0	0.63
