	id	listing_url	scrape_id	last_scraped	name	summary	space	description	experiences_offered	neighborhood_overview	notes	transit	access	interaction	house_rules	thumbnail_url	medium_url	picture_url	xl_picture_url	host_id	host_url	host_name	host_since	host_location	host_about	host_response_time	host_response_rate	host_acceptance_rate	host_is_superhost	host_thumbnail_url	host_picture_url	host_neighbourhood	host_listings_count	host_total_listings_count	host_verifications	host_has_profile_pic	host_identity_verified	street	neighbourhood	neighbourhood_cleansed	neighbourhood_group_cleansed	city	state	zipcode	market	smart_location	country_code	country	latitude	longitude	is_location_exact	property_type	room_type	accommodates	bathrooms	bedrooms	beds	bed_type	amenities	square_feet	price	weekly_price	monthly_price	security_deposit	cleaning_fee	guests_included	extra_people	minimum_nights	maximum_nights	minimum_minimum_nights	maximum_minimum_nights	minimum_maximum_nights	maximum_maximum_nights	minimum_nights_avg_ntm	maximum_nights_avg_ntm	calendar_updated	has_availability	availability_30	availability_60	availability_90	availability_365	calendar_last_scraped	number_of_reviews	number_of_reviews_ltm	first_review	last_review	review_scores_rating	review_scores_accuracy	review_scores_cleanliness	review_scores_checkin	review_scores_communication	review_scores_location	review_scores_value	requires_license	license	jurisdiction_names	instant_bookable	is_business_travel_ready	cancellation_policy	require_guest_profile_picture	require_guest_phone_verification	calculated_host_listings_count	calculated_host_listings_count_entire_homes	calculated_host_listings_count_private_rooms	calculated_host_listings_count_shared_rooms	reviews_per_month
0	2595	https://www.airbnb.com/rooms/2595	20200212052319	2020-02-12	Skylit Midtown Castle	Beautiful, spacious skylit studio in the heart of Midtown, Manhattan.  STUNNING SKYLIT STUDIO / 1 BED + SINGLE / FULL BATH / FULL KITCHEN / FIREPLACE / CENTRALLY LOCATED / WiFi + APPLE TV / SHEETS + TOWELS	- Spacious (500+ft²), immaculate and nicely furnished & designed studio. - Tuck yourself into the ultra comfortable bed under the skylight. Fall in love with a myriad of bright lights in the city night sky.  - Single-sized bed/convertible floor mattress with luxury bedding (available upon request). - Gorgeous pyramid skylight with amazing diffused natural light, stunning architectural details, soaring high vaulted ceilings, exposed brick, wood burning fireplace, floor seating area with natural zafu cushions, modern style mixed with eclectic art & antique treasures, large full bath, newly renovated kitchen, air conditioning/heat, high speed WiFi Internet, and Apple TV. - Centrally located in the heart of Midtown Manhattan just a few blocks from all subway connections in the very desirable Midtown location a few minutes walk to Times Square, the Theater District, Bryant Park and Herald Square. - The Midtown Castle is a uniquely charming Dutch Colonial survivor from the 1890s.  - This is 	Beautiful, spacious skylit studio in the heart of Midtown, Manhattan.  STUNNING SKYLIT STUDIO / 1 BED + SINGLE / FULL BATH / FULL KITCHEN / FIREPLACE / CENTRALLY LOCATED / WiFi + APPLE TV / SHEETS + TOWELS - Spacious (500+ft²), immaculate and nicely furnished & designed studio. - Tuck yourself into the ultra comfortable bed under the skylight. Fall in love with a myriad of bright lights in the city night sky.  - Single-sized bed/convertible floor mattress with luxury bedding (available upon request). - Gorgeous pyramid skylight with amazing diffused natural light, stunning architectural details, soaring high vaulted ceilings, exposed brick, wood burning fireplace, floor seating area with natural zafu cushions, modern style mixed with eclectic art & antique treasures, large full bath, newly renovated kitchen, air conditioning/heat, high speed WiFi Internet, and Apple TV. - Centrally located in the heart of Midtown Manhattan just a few blocks from all subway connections in the very desir	none	Centrally located in the heart of Manhattan just a few blocks from all subway connections in the very desirable Midtown location a few minutes walk to Times Square, the Theater District, Bryant Park and Herald Square.		Apartment is located on 37th Street between 5th & 6th Avenue, just a few blocks from all subway connections. Closest Subways (in order of proximity to apartment (Website hidden by Airbnb) W: 34th Street & 6th Avenu (Website hidden by Airbnb) 3: 34th Street & 7th Avenue 7: 42nd & 5th Avenu (Website hidden by Airbnb) S: 42nd Street between Park & Lexington Avenue (Website hidden by Airbnb) E: 34th Street and 8th Avenue If coming by car, there is a parking garage on the block and free street parking.	Guests have full access to the kitchen, bathroom and living spaces. The closets are private/off limits.	I am a Sound Therapy Practitioner and Kundalini Yoga & Meditation teacher. I work with energy and sound for relaxation and healing, using Symphonic gong, singing bowls, tuning forks, drums, voice and other instruments. Sound relaxation sessions and/or personalized Kundalini Yoga sessions are available in the space upon request. Individual, couples or group sessions available. Licensed acupuncture and massage also available upon request. Please inquire. I welcome my guests at the apartment for check-in, or alternatively, a self check-in can be arranged. Once you are settled in, I am just a phone call, text or email away, should you have any questions, concerns or issues during your stay. My desire is that you have a smooth arrival and amazing stay here.	Make yourself at home, respect the space and the neighbors. No pets, no smoking and no unauthorized guests.			https://a0.muscache.com/im/pictures/f0813a11-40b2-489e-8217-89a2e1637830.jpg?aki_policy=large		2845	https://www.airbnb.com/users/show/2845	Jennifer	2008-09-09	New York, New York, United States	"A New Yorker since 2000! My passion is creating beautiful, unique spaces where unforgettable memories are made. It's my pleasure to host people from around the world and meet new faces. Welcome travelers! 

I am a Sound Therapy Practitioner and Kundalini Yoga & Meditation teacher. I work with energy and sound for relaxation and healing, using Symphonic gong, singing bowls, tuning forks, drums, voice and other instruments."	within a day	50%	38%	f	https://a0.muscache.com/im/users/2845/profile_pic/1259095067/original.jpg?aki_policy=profile_small	https://a0.muscache.com/im/users/2845/profile_pic/1259095067/original.jpg?aki_policy=profile_x_medium	Midtown	6	6	['email', 'phone', 'reviews', 'offline_government_id', 'kba', 'selfie', 'government_id', 'identity_manual', 'work_email']	t	t	New York, NY, United States	Midtown	Midtown	Manhattan	New York	NY	10018	New York	New York, NY	US	United States	40.75362	-73.98376999999999	f	Apartment	Entire home/apt	1	1.0	0.0	1	Real Bed	"{TV,Wifi,""Air conditioning"",Kitchen,""Paid parking off premises"",""Free street parking"",Heating,""Family/kid friendly"",""Smoke detector"",""Carbon monoxide detector"",""Fire extinguisher"",Essentials,""Lock on bedroom door"",""Hair dryer"",Iron,""Laptop friendly workspace"",""Self check-in"",Keypad,""Private living room"",Bathtub,""Hot water"",""Bed linens"",""Extra pillows and blankets"",""Ethernet connection"",""Coffee maker"",Refrigerator,""Dishes and silverware"",""Cooking basics"",Oven,Stove,""Luggage dropoff allowed"",""Long term stays allowed"",""Cleaning before checkout""}"		$225.00	$1,995.00		$350.00	$95.00	1	$0.00	7	1125	7	7	1125	1125	7.0	1125.0	3 months ago	t	30	60	90	365	2020-02-12	48	5	2009-11-21	2019-11-04	94.0	9.0	9.0	10.0	10.0	10.0	9.0	f			f	f	strict_14_with_grace_period	t	t	2	2	0	0	0.39
1	3831	https://www.airbnb.com/rooms/3831	20200212052319	2020-02-13	Cozy Entire Floor of Brownstone	Urban retreat: enjoy 500 s.f. floor in 1899 brownstone, with wood and ceramic flooring throughout (completed Aug. 2015 through Sept. 2015), roomy bdrm, & upgraded kitchen & bathroom (completed Oct. 2015).  It's sunny and loaded with everything you need!	Greetings!      We own a double-duplex brownstone in Clinton Hill on Gates near Classon Avenue -  (7 blocks to C train, 5 blocks to G train, minutes to all), in which we host on the entire top floor of the upper duplex.  This is more of an efficiency set-up: it is the top floor on a two-family, double duplex brownstone.  The top floor for our guests consists of a sizable bedroom, full bath and eat-in kitchen for your exclusive use.  Our family occupies the floors below.  You go through a common hallway and staircase, to get to the top floor (2 easy flights up from the main entrance), but not through any rooms, so it is a fairly private set-up. - Clinton Hill, Gates Avenue near Classon Ave. (1 mi. or less to Williamsburg, Park Slope, Prospect Heights, downtown, Ft. Greene, Bed-Stuy, Bushwick; 20 mins to Manhattan) - includes FiOS, heat (or A/C), hot water, and electricity all included - furnished with two twin beds (convertible into a king bed), one rollaway twin bed and one inflatable 	Urban retreat: enjoy 500 s.f. floor in 1899 brownstone, with wood and ceramic flooring throughout (completed Aug. 2015 through Sept. 2015), roomy bdrm, & upgraded kitchen & bathroom (completed Oct. 2015).  It's sunny and loaded with everything you need! Greetings!      We own a double-duplex brownstone in Clinton Hill on Gates near Classon Avenue -  (7 blocks to C train, 5 blocks to G train, minutes to all), in which we host on the entire top floor of the upper duplex.  This is more of an efficiency set-up: it is the top floor on a two-family, double duplex brownstone.  The top floor for our guests consists of a sizable bedroom, full bath and eat-in kitchen for your exclusive use.  Our family occupies the floors below.  You go through a common hallway and staircase, to get to the top floor (2 easy flights up from the main entrance), but not through any rooms, so it is a fairly private set-up. - Clinton Hill, Gates Avenue near Classon Ave. (1 mi. or less to Williamsburg, Park Slope, Pro	none	Just the right mix of urban center and local neighborhood; close to all but enough quiet for a calming walk.		B52 bus for a 10-minute ride to downtown Brooklyn is a few yards away on the corner; G train/Classon Avenue is 5 blocks away; C train is about 6 blocks to either the Clinton/Washington stop or Franklin Avenue stop.  There is on-street parking, alternate side is twice per week on the immediate block but only once per week on Classon.  From LaGuardia Airport, a taxi will cost $30-$35, but there is also a bus that will put you at the Jackson Heights subway station, and from there it's about 5 stops to catch the G train, which stops 5 blocks away.  From JFK, the taxi is closer to $40, but the AirTran can get you conveniently to the A/C line and the C train is about 6 blocks from here.   From JFK via subway/metro/train: From JFK take the AirTrain to Howard Beach to catch the A train toward Brooklyn/Manhattan.  Take the A train to Utica Avenue and go across that same platform to catch the C local train (you could also transfer at Nostrand but you would have to carry luggage downstairs to cat	"You will have the private, exclusive use of and access to the top floor of our brownstone: a sizable private bedroom as described in ""The Space"" section, furnished with two twin beds (which we will combine into one king bed upon request) and optional rollaway twin and/or inflatable beds,  and other small furnishings; full private bath and private eat-in kitchen both renovated in Fall 2015; sizable dining table in sun-filled kitchen area doubles as a great desk space; alcove perfect for vertical bike storage. Upon request you may also have some use of the livingroom on the floor just below."	We'll be around, but since you have the top floor to yourself, most of the interaction is on the way in or out - we're open to socializing and did so frequently with our last long-term guests, so it's really up to you	Smoking - outside please; pets allowed but please contact me first for arrangements			https://a0.muscache.com/im/pictures/e49999c2-9fd5-4ad5-b7cc-224deac989aa.jpg?aki_policy=large		4869	https://www.airbnb.com/users/show/4869	LisaRoxanne	2008-12-07	New York, New York, United States	Laid-back bi-coastal actor/professor/attorney.	within an hour	100%	96%	f	https://a0.muscache.com/im/users/4869/profile_pic/1371927771/original.jpg?aki_policy=profile_small	https://a0.muscache.com/im/users/4869/profile_pic/1371927771/original.jpg?aki_policy=profile_x_medium	Clinton Hill	1	1	['email', 'phone', 'reviews', 'kba']	t	t	Brooklyn, NY, United States	Brooklyn	Clinton Hill	Brooklyn	Brooklyn	NY	11238	New York	Brooklyn, NY	US	United States	40.685140000000004	-73.95976	t	Guest suite	Entire home/apt	3	1.0	1.0	4	Real Bed	"{TV,""Cable TV"",Internet,Wifi,""Air conditioning"",Kitchen,""Pets allowed"",""Free street parking"",Heating,""Family/kid friendly"",""Smoke detector"",""Carbon monoxide detector"",""Fire extinguisher"",Essentials,Shampoo,""Lock on bedroom door"",""24-hour check-in"",Hangers,""Hair dryer"",Iron,""Laptop friendly workspace"",""Self check-in"",Lockbox,Bathtub,""High chair"",""Stair gates"",""Children’s books and toys"",""Pack ’n Play/travel crib"",""Hot water"",Microwave,""Coffee maker"",Refrigerator,""Dishes and silverware"",""Cooking basics"",Oven,Stove,""Luggage dropoff allowed"",""Long term stays allowed""}"	500.0	$89.00	$575.00	$2,100.00	$500.00		1	$0.00	1	730	1	1	730	730	1.0	730.0	a week ago	t	7	8	14	137	2020-02-13	307	70	2014-09-30	2020-02-08	90.0	9.0	9.0	10.0	9.0	10.0	9.0	f			f	f	moderate	f	f	1	1	0	0	4.69
2	5099	https://www.airbnb.com/rooms/5099	20200212052319	2020-02-12	Large Cozy 1 BR Apartment In Midtown East	My large 1 bedroom apartment has a true New York City feel.  The apt is in midtown on the east side and centrally located, just a 10-minute walk from Grand Central Station, Empire State Building, Times Square. The kitchen and living room are large and bright with Apple TV. I have a new Queen Bed that sleeps 2 people, and a Queen Aero Bed that can sleep 2 people in the living room. The apartment is located on the 5th floor of a walk up - no elevator (lift).	I have a large 1 bedroom apartment centrally located in Midtown East.  A 10 minute walk from Grand Central Station, Times Square, Empire State Building and all major subway and bus lines. The apartment is located on the 5th floor of a pre-war walk up building-no elevator/lift.  The apartment is bright with has high ceilings and flow through rooms. A spacious, cozy living room with Netflix and Apple TV.  A large bright kitchen to sit and enjoy coffee or tea.  The bedroom is spacious with a comfortable queen size bed that sleeps 2.   I have a comfortable queen size aero bed that fits in the living room and sleeps 2. It can be tucked away for living space and opened when ready for bed. I'd be happy to give you tips and advice on the best ways to experience the most of  NYC. The apartment's location is great for sightseeing. ** Check out my listing guidebook **   If you would like to stay local in the area, there is a very long & famous strip of bars and restaurants along 3rd Avenue, which	My large 1 bedroom apartment has a true New York City feel.  The apt is in midtown on the east side and centrally located, just a 10-minute walk from Grand Central Station, Empire State Building, Times Square. The kitchen and living room are large and bright with Apple TV. I have a new Queen Bed that sleeps 2 people, and a Queen Aero Bed that can sleep 2 people in the living room. The apartment is located on the 5th floor of a walk up - no elevator (lift). I have a large 1 bedroom apartment centrally located in Midtown East.  A 10 minute walk from Grand Central Station, Times Square, Empire State Building and all major subway and bus lines. The apartment is located on the 5th floor of a pre-war walk up building-no elevator/lift.  The apartment is bright with has high ceilings and flow through rooms. A spacious, cozy living room with Netflix and Apple TV.  A large bright kitchen to sit and enjoy coffee or tea.  The bedroom is spacious with a comfortable queen size bed that sleeps 2.   I	none	My neighborhood in Midtown East is called Murray Hill. The area is very centrally located with easy access to explore . The apartment is about 5 blocks (7 minute walk) to the United Nations and Grand Central Station the main and most historic train station.  Grand Central will give you access to every train in the city. The apartment is also very close to main attractions, It's about a 10 minute walk to both the Empire State Building and Times Square.  There's a great shopping area with dozens of stores including H&M, Zara, The Gap, BeBe and the world famous Macy's department store. These shops are a 10 minute walk up East 34th Street from 5th avenue and 8th avenue.   If you would like to stay local in the area, there is a very long & famous strip of bars and restaurants along 3rd avenue, which is just around the corner from the apartment. It's commonly known as the 3rd avenue strip.	Read My Full Listing For All Information. New York City really is the city that doesn't sleep. There's a constant flow of people, bikes and cars. The city can be noisy at times, if you're a light sleeper, ear plugs would help. Check out my local guide book for things to do.	From the apartment is a 10 minute walk to Grand Central Station on East 42nd Street, a 10 minute walk to the Empire State Building on East 34th Street and 5th Avenue, a 10 minute walk to Times Square on West 42 Street and about 20 minutes walk to Central Park on 59th Street. Depending on how long you are staying, I would recommend a 7 day unlimited metro card. This allows you to travel unlimited all day and night on any train or bus in and outside of the city.  Grand Central Station is the main NYC train station. You can find any train connection and get anywhere in Manhattan from Grand Central Station. You can get to Brooklyn, Queens, The Bronx and Staten Island from Grand Central Station The M15 bus is around the corner on 2nd avenue. This bus will take you from uptown Harlem to the East Village and South Street Seaport. It will also take you to the Staten Island ferry and Statue of Liberty and everywhere in between along the east side.  The M101 bus is just up the street on 3rd aven	I will meet you upon arrival.	I usually check in with guests via text or email. I'm available by text, email or phone call with any questions, suggestions or to help out.	• Check-in time is 2PM. • Check-out time is 12 PM. Please be respectful of the space and leave the apartment in the condition you were welcomed into.			https://a0.muscache.com/im/pictures/24020910/16cd7f5a_original.jpg?aki_policy=large		7322	https://www.airbnb.com/users/show/7322	Chris	2009-02-02	New York, New York, United States	I'm an artist, writer, traveler, and a native new yorker. Welcome to my city.			71%	f	https://a0.muscache.com/im/pictures/user/26745d24-d818-4bf5-8f9e-26b097121ba7.jpg?aki_policy=profile_small	https://a0.muscache.com/im/pictures/user/26745d24-d818-4bf5-8f9e-26b097121ba7.jpg?aki_policy=profile_x_medium	Flatiron District	1	1	['email', 'phone', 'reviews', 'jumio', 'government_id']	t	f	New York, NY, United States	Manhattan	Murray Hill	Manhattan	New York	NY	10016	New York	New York, NY	US	United States	40.74767	-73.975	f	Apartment	Entire home/apt	2	1.0	1.0	1	Real Bed	"{TV,""Cable TV"",Internet,Wifi,""Air conditioning"",Kitchen,""Buzzer/wireless intercom"",Heating,""Smoke detector"",""Carbon monoxide detector"",""First aid kit"",""Fire extinguisher"",Essentials,Shampoo,Hangers,""Hair dryer"",Iron,""Laptop friendly workspace"",""translation missing: en.hosting_amenity_49"",""translation missing: en.hosting_amenity_50"",Bathtub,""Hot water"",""Bed linens"",""Extra pillows and blankets"",Microwave,""Coffee maker"",Refrigerator,""Dishes and silverware"",""Cooking basics"",Oven,Stove,""Host greets you""}"		$200.00			$300.00	$125.00	2	$100.00	3	21	3	3	21	21	3.0	21.0	3 months ago	t	0	0	0	0	2020-02-12	78	8	2009-04-20	2019-10-13	90.0	10.0	9.0	10.0	10.0	10.0	9.0	f			f	f	moderate	t	t	1	1	0	0	0.59
3	5121	https://www.airbnb.com/rooms/5121	20200212052319	2020-02-12	BlissArtsSpace!		HELLO EVERYONE AND THANKS FOR VISITING BLISS ART SPACE!  Thank you all for your support. I've traveled a lot in the last year few years, to the  U.K. Germany, Italy and France! Loved Paris, Berlin and Calabria! Highly recommend all these places.  One room available for rent in a 2 bedroom apt in Bklyn. We share a common space with kitchen. I am an artist(painter, filmmaker) and curator who is working in the film industry while I'm building my art event production businesses. Price above is nightly for one person. Monthly rates available.  Price is $900 per month for one person. Utilities not included, they are about 50 bucks, payable when the bill arrives mid month.   Couples rates are slightly more for monthly and 90$ per night short term. If you are a couple please Iet me know and I’ll give you the monthly rate for that. Room rental is on a temporary basis, perfect from 2- 6 months - no long term requests please! At the moment I AM ONLY TAKING BOOKINGS OF AT LEAST ONE OR ONE AND A HA	HELLO EVERYONE AND THANKS FOR VISITING BLISS ART SPACE!  Thank you all for your support. I've traveled a lot in the last year few years, to the  U.K. Germany, Italy and France! Loved Paris, Berlin and Calabria! Highly recommend all these places.  One room available for rent in a 2 bedroom apt in Bklyn. We share a common space with kitchen. I am an artist(painter, filmmaker) and curator who is working in the film industry while I'm building my art event production businesses. Price above is nightly for one person. Monthly rates available.  Price is $900 per month for one person. Utilities not included, they are about 50 bucks, payable when the bill arrives mid month.   Couples rates are slightly more for monthly and 90$ per night short term. If you are a couple please Iet me know and I’ll give you the monthly rate for that. Room rental is on a temporary basis, perfect from 2- 6 months - no long term requests please! At the moment I AM ONLY TAKING BOOKINGS OF AT LEAST ONE OR ONE AND A HA	none									https://a0.muscache.com/im/pictures/2090980c-b68e-4349-a874-4818402923e7.jpg?aki_policy=large		7356	https://www.airbnb.com/users/show/7356	Garon	2009-02-03	New York, New York, United States	" I am an artist(painter, filmmaker) and curator who is working in the film industry while I'm building my business.

I am extremely easy going and would like that you are the laid back
and enjoy life kind of person. I also ask that you are open, honest
and easy to communicate with as this is how I like to live my life.And of course creative people are very welcome!
"			67%	f	https://a0.muscache.com/im/pictures/user/72a61bea-cfb1-45b6-abbb-85bdbd790b32.jpg?aki_policy=profile_small	https://a0.muscache.com/im/pictures/user/72a61bea-cfb1-45b6-abbb-85bdbd790b32.jpg?aki_policy=profile_x_medium	Bedford-Stuyvesant	1	1	['email', 'phone', 'facebook', 'reviews', 'offline_government_id', 'selfie', 'government_id', 'identity_manual']	t	f	Brooklyn, NY, United States	Bedford-Stuyvesant	Bedford-Stuyvesant	Brooklyn	Brooklyn	NY	11216	New York	Brooklyn, NY	US	United States	40.68688	-73.95596	f	Apartment	Private room	2		1.0	1	Futon	"{Wifi,""Air conditioning"",Kitchen,""Pets live on this property"",Cat(s),Heating}"		$60.00			$450.00	$0.00	1	$30.00	29	730	29	29	730	730	29.0	730.0	25 months ago	t	30	60	90	365	2020-02-12	50	1	2009-05-28	2019-12-02	90.0	8.0	8.0	10.0	10.0	9.0	9.0	f			f	f	strict_14_with_grace_period	f	f	1	0	1	0	0.38
