76	20734	https://www.airbnb.com/rooms/20734	20200212052319	2020-02-13	Spacious Prospect Heights Apartment	Bright, spacious apartment in Prospect Heights Brooklyn. Vibrant neighborhood filled with restaurants, shopping and nearby transportation. Unwind in peacful comfort after exploring the best that NY and Brooklyn have to offer. Minutes by train to NYC	Floor thru apartment in Prospect Heights Brooklyn.  Many amenities are provided for your comfort. Closet space is abundant. The bedroom has a queen sized bed and the living room has a double sofa bed.	Bright, spacious apartment in Prospect Heights Brooklyn. Vibrant neighborhood filled with restaurants, shopping and nearby transportation. Unwind in peacful comfort after exploring the best that NY and Brooklyn have to offer. Minutes by train to NYC Floor thru apartment in Prospect Heights Brooklyn.  Many amenities are provided for your comfort. Closet space is abundant. The bedroom has a queen sized bed and the living room has a double sofa bed. Access to the apartment is through the building front entrance at the top of a staircase and one flight up. Sean and Lynette will be your hosts for your stay Prospect Heights Brooklyn. We are owner occupied and live in the ground floor apartment with our daughter. Our neighborhood is vibrant and fun. Our building is peaceful and welcoming. You can reach us by email, cell phone and text message if we are not on the site. We will do our best to ensure that your stay here is one to fondly remember. The building is close to trains and buses, and a	none	The building is close to trains and buses, and a few minutes walk from Prospect Park, Brooklyn Botanic Gardens, Brooklyn Museum and a short walk from the Barclays Center and the Atlantic Center Mall. The area is surrounded by restaurants, shops and the occasional night life. We are 30 minutes from Manhattan by subway. Many subway lines and the Long Island Rail Road are within walking distance of a few blocks. James, Born Thai, Latin Ideya, Geido Sushi and Anarchy are the restaurants we frequent , but are only a few of the many that are a short walk away. The Burrito Bar , Bar Chuko, Tony Romas and Montrose are some of thte local bars that you can walk to explore.	Street parking is limited but shops, restaurants, markets, pharmacies and virtually all metro subway lines are within walking distance. We will help you get around with maps, directions and suggestions about places to visit and things to do. Please refer to this video for help with operating our stove: (Website hidden by Airbnb)	Two blocks to the metro station which takes you to Lower Manhattan in 15 minutes and downtown Manhattan in 30 minutes. Local transportation via bus is abundant. DIRECTIONS TO OUR HOUSE FROM JFK AIRPORT USING PUBLIC TRANSPORTATION details to be provided upon booking: The JFK air train will take you to Jamaica Railroad station. From there you will take a Long Island Railroad commuter train to FLATBUSH AVENUE in Brooklyn. It will be the last stop and is only a 30 minute or less commute. Use a kiosk to purchase a ticket before entering the railroad station because purchasing a ticket on the train is significantly higher and the ticket agents are in another building across the terminal.  When you get to the Flatbush avenue terminal go upstairs to the street level and verify that you are standing on Flatbush Avenue. The Barclays Center will be to your left. Walk on Flatbush Avenue towards the Barclays Center and you walk right into xxxx STREET which is on the corner of the Barclays Center. M	Access to the apartment is through the building front entrance at the top of a staircase and one flight up.	Sean and Lynette will be your hosts for your stay Prospect Heights Brooklyn. We are owner occupied and live in the ground floor apartment with our daughter. Our neighborhood is vibrant and fun. Our building is peaceful and welcoming. You can reach us by email, cell phone and text message if we are not on the site. We will do our best to ensure that your stay here is one to fondly remember.	**PLEASE READ THE HOUSE RULES** - Please be respectful of our neighbors. No parties or other loud activities in the apartment, hallways or on the building steps. - No pets in the apartment - Absolutely no smoking in the apartment or building corridors. - Do not smoke on the building steps. Please move away from the building to smoke so that the smoke does not travel into the building. - Close all windows before turning on air conditioners. Please do not leave the air conditioner running when leaving the apartment during the summer.  - Substituting Guests: The person(s) booking the apartment must be the guest(s) occupying the apartment for the total period reserved. The owner of the Airbnb profile may not book for another person or family member. Also, the Airbnb profile owner may not vacate the apartment in advance of the end of booking period. With this in mind, guest responsibilities cannot be transferred or assumed by another party. There are no exceptions to this rule. *Any indicat			https://a0.muscache.com/im/pictures/90387901/916254a1_original.jpg?aki_policy=large		78460	https://www.airbnb.com/users/show/78460	Sean & Lynette	2010-02-07	New York, New York, United States	 We've lived in Brooklyn for over 25 years, and enjoy all NY and our neighborhood have to offer. Here with our daughter, we put family first, have as much fun together as possible and travel often to experience new wonders. We look forward to hosting you and making your visit to Brooklyn, and all of NY the best it can be.	within an hour	100%	99%	t	https://a0.muscache.com/im/users/78460/profile_pic/1435427484/original.jpg?aki_policy=profile_small	https://a0.muscache.com/im/users/78460/profile_pic/1435427484/original.jpg?aki_policy=profile_x_medium	Prospect Heights	1	1	['email', 'phone', 'reviews', 'kba']	t	t	Brooklyn, NY, United States	Brooklyn	Prospect Heights	Brooklyn	Brooklyn	NY	11217	New York	Brooklyn, NY	US	United States	40.68233	-73.97261	t	Townhouse	Entire home/apt	4	1.0	1.0	1	Real Bed	"{TV,Internet,Wifi,""Air conditioning"",Kitchen,""Free street parking"",""Buzzer/wireless intercom"",Heating,""Family/kid friendly"",""Smoke detector"",""Carbon monoxide detector"",""First aid kit"",""Safety card"",""Fire extinguisher"",Essentials,Shampoo,Hangers,""Hair dryer"",Iron,""Laptop friendly workspace"",""Self check-in"",Lockbox,Microwave,""Coffee maker"",Refrigerator,""Dishes and silverware"",""Cooking basics""}"		$135.00	$825.00	$2,700.00	$250.00	$80.00	1	$0.00	3	29	3	3	29	29	3.0	29.0	4 weeks ago	t	3	7	13	85	2020-02-13	197	48	2015-07-08	2020-02-10	98.0	10.0	10.0	10.0	10.0	10.0	10.0	f			t	f	moderate	f	f	1	1	0	0	3.51
77	20755	https://www.airbnb.com/rooms/20755	20200212052319	2020-02-13	Large Parlor Room, Landmark Home 1 block to PRATT		The room is a converted parlor room, separated from the rest of the house by 4 sliding frosted glass doors behind 2 sets of curtains. There is a Queen size bed, a wardrobe, a desk and chair, a pair of occasional chairs and a large and heavy safe (the sliding doors do not lock). The private bath is newly renovated (January 2019) with stone and porcelain subway tiles, a rainfall shower-head and a roomy shower area. The sink and vanity cabinet offer plenty of storage. There are hardwood floors and historic details throughout the house, a pretty fireplace (non-working) and a large window overlooking a private balcony to the backyard. The shared kitchen is large with a center island stool seating for 4, bistro seating for 4, stainless steel appliances including a dishwasher.  The house is a 3 bedroom, 3 bath landmark two family brick home on a vibrant and safe block of Clinton Hill, Brooklyn. Transportation is nearby as the house is around the corner from the G-train at Clinton-Washington a	The room is a converted parlor room, separated from the rest of the house by 4 sliding frosted glass doors behind 2 sets of curtains. There is a Queen size bed, a wardrobe, a desk and chair, a pair of occasional chairs and a large and heavy safe (the sliding doors do not lock). The private bath is newly renovated (January 2019) with stone and porcelain subway tiles, a rainfall shower-head and a roomy shower area. The sink and vanity cabinet offer plenty of storage. There are hardwood floors and historic details throughout the house, a pretty fireplace (non-working) and a large window overlooking a private balcony to the backyard. The shared kitchen is large with a center island stool seating for 4, bistro seating for 4, stainless steel appliances including a dishwasher.  The house is a 3 bedroom, 3 bath landmark two family brick home on a vibrant and safe block of Clinton Hill, Brooklyn. Transportation is nearby as the house is around the corner from the G-train at Clinton-Washington a	none						clean up after yourself be respectful of housemates no shoes allowed in house (shelving units in foyer provided to keep shoes) smoking permitted outside of home only, across the street in front of Higgins Hall at Pratt, Not Permitted on front stoop			https://a0.muscache.com/im/pictures/c87c7b56-848c-4362-b245-6a6495fe0f14.jpg?aki_policy=large		51038	https://www.airbnb.com/users/show/51038	Erica	2009-11-03	New York, New York, United States	"Native NYer who appreciates the beauty of life and nature outside of the concrete jungle... and loves the beach.



"	within an hour	100%	96%	t	https://a0.muscache.com/im/pictures/user/19d1bc74-1cf5-47cc-8f16-a72b14bc7b59.jpg?aki_policy=profile_small	https://a0.muscache.com/im/pictures/user/19d1bc74-1cf5-47cc-8f16-a72b14bc7b59.jpg?aki_policy=profile_x_medium	Clinton Hill	8	8	['email', 'phone', 'reviews', 'jumio', 'offline_government_id', 'kba', 'government_id']	t	t	Brooklyn, NY, United States	Clinton Hill	Clinton Hill	Brooklyn	Brooklyn	NY	11238	New York	Brooklyn, NY	US	United States	40.68634	-73.96600000000001	t	Townhouse	Private room	3	1.0	1.0	2	Real Bed	"{Internet,Wifi,Kitchen,""Free street parking"",""Indoor fireplace"",Heating,Washer,Dryer,Essentials,""translation missing: en.hosting_amenity_49"",""translation missing: en.hosting_amenity_50"",""Hot water""}"		$98.00	$898.00	$1,898.00	$300.00	$75.00	1	$10.00	7	365	7	7	365	365	7.0	365.0	3 months ago	t	0	0	18	293	2020-02-13	18	4	2012-12-16	2019-09-26	89.0	9.0	8.0	10.0	9.0	10.0	9.0	f			t	f	strict_14_with_grace_period	f	f	6	2	4	0	0.21
78	20853	https://www.airbnb.com/rooms/20853	20200212052319	2020-02-13	2-bed brownstone duplex + garden	My apartment has been called cozy, warm and comfortable.  It's updated, spacious apartment located in a popular Brooklyn neighborhood. Great for spending time at home, but close to restaurants, bars, shops and transportation, too.	"I believe that I'd found the perfect location and neighborhood when I bought and renovated this 2-family brownstone in 2004. The House ------------- As a visual artist, natural light is very important to me, and I find traditional brownstones to be dark. So I had a gut renovation and added large picture windows to make the space open, bright and airy.  The renovation also included the complete update of all electrical, plumbing and heating systems. Central air conditioning was added, too. The upstairs consists of the living room (with the large, north-facing picture window, overlooking the backyard garden below), the kitchen that's open to the living room with stone counter tops, modern appliances, and gas range, and a dining room/office in the front of the house facing Dean Street.  There's a half-bath just off the kitchen. The bedrooms are on the lower floor (called the ""garden level"" in Brooklyn real estate speak).  The master bedroom is large (20x16 feet) with a king-size Tempurped"	My apartment has been called cozy, warm and comfortable.  It's updated, spacious apartment located in a popular Brooklyn neighborhood. Great for spending time at home, but close to restaurants, bars, shops and transportation, too. I believe that I'd found the perfect location and neighborhood when I bought and renovated this 2-family brownstone in 2004. The House ------------- As a visual artist, natural light is very important to me, and I find traditional brownstones to be dark. So I had a gut renovation and added large picture windows to make the space open, bright and airy.  The renovation also included the complete update of all electrical, plumbing and heating systems. Central air conditioning was added, too. The upstairs consists of the living room (with the large, north-facing picture window, overlooking the backyard garden below), the kitchen that's open to the living room with stone counter tops, modern appliances, and gas range, and a dining room/office in the front of the h	none						- Occasional watering of plants - Putting garbage and recycling out on the curb on designated nights - Bring in mail in from the mailbox			https://a0.muscache.com/im/pictures/22323323/8e5a7f92_original.jpg?aki_policy=large		79070	https://www.airbnb.com/users/show/79070	Tracy	2010-02-08	New York, New York, United States	"Freelance photographer, animator and multimedia artist.

In addition to my Brooklyn, New York home, I'm also listing rooms for my parents' bed & breakfast in New Preston, Connecticut."	within a day	100%	78%	f	https://a0.muscache.com/im/users/79070/profile_pic/1376371552/original.jpg?aki_policy=profile_small	https://a0.muscache.com/im/users/79070/profile_pic/1376371552/original.jpg?aki_policy=profile_x_medium	Prospect Heights	3	3	['email', 'phone', 'facebook', 'reviews', 'jumio', 'offline_government_id', 'kba', 'selfie', 'government_id', 'work_email']	t	t	Brooklyn, NY, United States	Brooklyn	Prospect Heights	Brooklyn	Brooklyn	NY	11217	New York	Brooklyn, NY	US	United States	40.68035	-73.97162	t	Apartment	Entire home/apt	4	2.5	2.0	3	Real Bed	"{TV,""Cable TV"",Internet,Wifi,""Air conditioning"",Kitchen,""Free street parking"",Heating,Washer,Dryer,""Smoke detector"",""Fire extinguisher"",Essentials,Hangers,""Hair dryer"",Iron,""Laptop friendly workspace"",""translation missing: en.hosting_amenity_49"",""translation missing: en.hosting_amenity_50"",""Private entrance"",""Hot water"",Microwave,Refrigerator,Dishwasher,""Dishes and silverware"",""Cooking basics"",Oven,Stove,""BBQ grill"",""Garden or backyard"",""Luggage dropoff allowed"",""Long term stays allowed"",""Host greets you""}"		$250.00	$1,400.00	$4,000.00	$500.00	$250.00	4	$50.00	21	120	21	21	120	120	21.0	120.0	2 months ago	t	0	0	1	227	2020-02-13	23	5	2013-11-10	2019-09-12	99.0	10.0	10.0	10.0	10.0	10.0	10.0	f			f	f	strict_14_with_grace_period	f	f	1	1	0	0	0.3
79	20913	https://www.airbnb.com/rooms/20913	20200212052319	2020-02-12	Charming 1 bed GR8 WBurg LOCATION!	"Two blocks from the subway and SO close to the famous Williamsburg ""hipster"" scene, this cozy, private apartment is perfect for a couple looking to experience all NYC has to offer and still go home to a safe, quiet place of their own."	Hello traveler!  I am constantly leaving town and would love to share my beautiful furnished apartment in South Williamsburg! My schedule is always changing, so email me and we'll figure something out! The rate is as follows: $110/night for two people. Each extra person is $15 extra per night.  The bedroom is of moderate size with a VERY comfortable full size bed and access to a fire escape, overlooking the tree-lined street. The closet in there won't be available for your use, but the large living room closet will be available to you. The kitchen is well-equipped for any cooking needs you may have, and you are more than welcome to use any condiments and spices you find. You also have access to my window herb garden! I just ask you water the plants once every three days, please. The bathroom has a toilet, shower/tub, and sink. The large living room has another mirroring fire escape out the living room window too, so take your pick! When all the windows are open, you get a wonderful bre	"Two blocks from the subway and SO close to the famous Williamsburg ""hipster"" scene, this cozy, private apartment is perfect for a couple looking to experience all NYC has to offer and still go home to a safe, quiet place of their own. Hello traveler!  I am constantly leaving town and would love to share my beautiful furnished apartment in South Williamsburg! My schedule is always changing, so email me and we'll figure something out! The rate is as follows: $110/night for two people. Each extra person is $15 extra per night.  The bedroom is of moderate size with a VERY comfortable full size bed and access to a fire escape, overlooking the tree-lined street. The closet in there won't be available for your use, but the large living room closet will be available to you. The kitchen is well-equipped for any cooking needs you may have, and you are more than welcome to use any condiments and spices you find. You also have access to my window herb garden! I just ask you water the plants once e"	none						Please water my little plants and smoke OUTSIDE ONLY! Also, the toilet is sensitive, so ONLY toilet paper goes in the toilet! Thanks!			https://a0.muscache.com/im/pictures/464331/d81eaf94_original.jpg?aki_policy=large		79402	https://www.airbnb.com/users/show/79402	Christiana	2010-02-09	New York, New York, United States	I'm an actor (and bartender) based in NYC. I love travel and food, and meeting new people from around the world. Whether I'm staying at your place, or you're staying at mine, I look forward to becoming friends!				f	https://a0.muscache.com/im/pictures/user/9e8b98cf-594d-4c91-a4f4-83d678268dc5.jpg?aki_policy=profile_small	https://a0.muscache.com/im/pictures/user/9e8b98cf-594d-4c91-a4f4-83d678268dc5.jpg?aki_policy=profile_x_medium	Williamsburg	1	1	['email', 'phone', 'reviews', 'jumio', 'government_id']	t	t	Brooklyn, NY, United States	Williamsburg	Williamsburg	Brooklyn	Brooklyn	NY	11211	New York	Brooklyn, NY	US	United States	40.70984	-73.95775	t	Apartment	Entire home/apt	2	1.0	1.0	1	Real Bed	"{Internet,Wifi,Kitchen,""Buzzer/wireless intercom"",Heating,""Smoke detector"",""Carbon monoxide detector"",""Fire extinguisher"",Essentials,""Self check-in"",Keypad}"		$100.00	$600.00	$2,300.00		$18.00	1	$0.00	5	365	5	5	365	365	5.0	365.0	12 months ago	t	0	0	0	0	2020-02-12	168	0	2010-09-27	2018-07-22	81.0	9.0	7.0	9.0	9.0	9.0	8.0	f			f	f	moderate	f	f	1	1	0	0	1.47
80	21293	https://www.airbnb.com/rooms/21293	20200212052319	2020-02-12	Sunny Apartment in Artist Home	Sunny, fully furnished, private apartment in artist's building. The space is decorated with contemporary art made by your host. Bushwick is a thriving artist community with so many great art galleries, cafes, restaurants and bars. Your hosts runs an art gallery next door. Our pad is easily accessible by bus and subway.	Beautiful, sunny apartment with separate bedroom. Wood floors in the living room and bedroom. Large, full kitchen. Even the bathroom gets direct sunlight.  The space is uncluttered spacious, only art made by host hangs from the walls. The furniture is also very unique, either collected antiques or hand made by an artist.   There is a queen size bed in the bedroom and a full size futon in the living room. The bed has a custom-made, artistic, steel headboard by Tripoli designs, your host. This is a great place to stay if you're looking for grass-roots art and music and cool places off the beaten track. We are located in Bushwick, home to a thriving arts community. We are within close walking distance of art galleries, cafes, and nice restaurants and bars.  Our house is a 7 min walk to the L train (Jefferson St stop); 15min train ride to Manhattan (East Village and Union Square.) We are also a 5 min walk to the M train (Central Ave stop); 15min train ride to Manhattan (Lower East Side, So	Sunny, fully furnished, private apartment in artist's building. The space is decorated with contemporary art made by your host. Bushwick is a thriving artist community with so many great art galleries, cafes, restaurants and bars. Your hosts runs an art gallery next door. Our pad is easily accessible by bus and subway. Beautiful, sunny apartment with separate bedroom. Wood floors in the living room and bedroom. Large, full kitchen. Even the bathroom gets direct sunlight.  The space is uncluttered spacious, only art made by host hangs from the walls. The furniture is also very unique, either collected antiques or hand made by an artist.   There is a queen size bed in the bedroom and a full size futon in the living room. The bed has a custom-made, artistic, steel headboard by Tripoli designs, your host. This is a great place to stay if you're looking for grass-roots art and music and cool places off the beaten track. We are located in Bushwick, home to a thriving arts community. We are w	none	Living in this house, in Bushwick for 12 years, we have really seen this neighborhood change from a small progressive art scene to a full blown art movement. Bushwick is the center of street art, graffiti  and murals.  It is  a popular destination of the New York City Free walking Tours. Bushwick graffiti and street art tours happen daily as well as many artists run art galleries, cafes and bars.		Easy to get around in Bushwick. Our home is situated at a bus stop on the B60 bus line that leads directly to south Williamsburg. Also 5-10 min walk to the L train that goes directly into Manhattan  and crosses Manhattan to connect with many other subway trains. We're a 5 min walk to the JMZ subway lines.	You access the building at the front door where there is a small entry, to your immediate left is the door to the apartment. Guests can easily access the two art galleries and the laundry facility through the back room of the galleries.	I live and work nearby so I am very available. My sculpture studio is one block away. My art gallery is adjacent to our home and I live upstairs from the apartment. Also in the neighborhood, many venues like  restaurants cafés and homeowners, have my decorative artistic  metal work. If you're interested in visiting these places send me a message and I'll give you the addresses.	No smoking inside; please smoke outside only. Try to be quiet with the front doors. Ask before using the laundry machines and plan to provide your own detergent. Separate recycling from your trash: paper and cardboard are separate from plastic, glass and metal. We appreciate if you take your trash outside in the bins provided. Please do have packages or mail sent to our house. Enjoy your stay!			https://a0.muscache.com/im/pictures/19e37d1c-9ca0-4da0-8656-5e7a60da6d59.jpg?aki_policy=large		44145	https://www.airbnb.com/users/show/44145	Tyrome	2009-10-07	New York, New York, United States	While my wife Silvia and I have managed our airbnb rentals for several years together, I will now be the main contact in order to give her a break. So here is a little about me. I'm a metal sculptor, assemblage artist with a degree in Biochemistry, I love to make art, surf and play with my two young kids, eat good food and travel. But now that I'm a Dad, I don't  travel as much, so I let we the travelers come to me. The kids and I love going to the beach at Rockaway, art openings and going to cafes. You might spot my kids and I racing down the sidewalks in Bushwick on our skateboards. 	within an hour	100%	100%	f	https://a0.muscache.com/im/pictures/user/41f9b077-3e02-491a-8f0b-84e237107d8f.jpg?aki_policy=profile_small	https://a0.muscache.com/im/pictures/user/41f9b077-3e02-491a-8f0b-84e237107d8f.jpg?aki_policy=profile_x_medium	Bushwick	2	2	['email', 'phone', 'facebook', 'reviews']	t	f	Brooklyn, NY, United States	Brooklyn	Bushwick	Brooklyn	Brooklyn	NY	11237	New York	Brooklyn, NY	US	United States	40.70093	-73.92609	t	Apartment	Entire home/apt	4	1.0	1.0	2	Real Bed	"{Wifi,""Air conditioning"",Kitchen,Heating,""Family/kid friendly"",Essentials,Shampoo,Hangers,""Hair dryer"",Iron,""Self check-in"",Lockbox,""Hot water"",""Bed linens"",""Extra pillows and blankets""}"		$105.00	$750.00	$2,450.00		$75.00	2	$20.00	3	100	3	3	100	100	3.0	100.0	3 days ago	t	4	12	26	26	2020-02-12	132	26	2010-04-13	2019-11-23	90.0	9.0	9.0	10.0	9.0	9.0	9.0	f			t	f	strict_14_with_grace_period	f	f	2	2	0	0	1.1
